{
  "version": "1.0",
  "description": "Strict policy - only implementation mode allows diffs, no commits allowed anywhere",
  "modes": {
    "implementation": {
      "allows_commit": false,
      "allows_diff": true,
      "allowed_operations": ["read", "write"],
      "risk_level": "moderate"
    },
    "design": {
      "allows_commit": false,
      "allows_diff": false,
      "allowed_operations": ["read"],
      "risk_level": "safe"
    },
    "chat": {
      "allows_commit": false,
      "allows_diff": false,
      "allowed_operations": ["read"],
      "risk_level": "safe"
    },
    "planning": {
      "allows_commit": false,
      "allows_diff": false,
      "allowed_operations": ["read"],
      "risk_level": "safe"
    },
    "debug": {
      "allows_commit": false,
      "allows_diff": false,
      "allowed_operations": ["read"],
      "risk_level": "safe"
    },
    "ops": {
      "allows_commit": false,
      "allows_diff": false,
      "allowed_operations": ["read"],
      "risk_level": "moderate"
    },
    "test": {
      "allows_commit": false,
      "allows_diff": false,
      "allowed_operations": ["read", "execute"],
      "risk_level": "safe"
    },
    "release": {
      "allows_commit": false,
      "allows_diff": false,
      "allowed_operations": ["read"],
      "risk_level": "high"
    },
    "experimental_open_plan": {
      "allows_commit": false,
      "allows_diff": false,
      "allowed_operations": ["read"],
      "risk_level": "safe"
    }
  },
  "default_permissions": {
    "allows_commit": false,
    "allows_diff": false,
    "allowed_operations": ["read"],
    "risk_level": "safe"
  }
}
